{"acceptance_certificate":"sha256:bfdfb8c971435c482e0d54fa6dcb63b4d9a760d3898832a882896b8eb865a113","accepted_ir":"sha256:984aabb857c595340a4edcb2a7170ed1c0065a118e1e77e195221bfbfcdaf457","artifact_slots":[{"node_id":"accepted-contract","role":"acceptance_certificate","slot_id":"acceptance-certificate"},{"node_id":"accepted-contract","role":"environment_export","slot_id":"accepted-environment"},{"node_id":"accepted-contract","role":"accepted_ir","slot_id":"accepted-ir"},{"node_id":"accepted-contract","role":"accepted_module","slot_id":"accepted-module"},{"node_id":"accepted-contract","role":"statements","slot_id":"accepted-statements"},{"node_id":"accepted-contract","role":"bridge_proposal","slot_id":"bridge-proposal"},{"node_id":"accepted-contract","role":"model","slot_id":"contract-model"},{"node_id":"accepted-contract","role":"profile","slot_id":"contract-profile"},{"node_id":"accepted-contract","role":"contract_import","slot_id":"import-receipt"},{"node_id":"vscore-program","role":"model","slot_id":"vscore-model"},{"node_id":"vscore-program","role":"profile","slot_id":"vscore-profile"},{"node_id":"vscore-program","role":"proof_source","slot_id":"vscore-proof"},{"node_id":"vscore-program","role":"readable_diagnostic","slot_id":"vscore-readable-diagnostic-0"},{"node_id":"vscore-program","role":"readable_selection","slot_id":"vscore-readable-selection"},{"node_id":"vscore-program","role":"relation","slot_id":"vscore-relation"},{"node_id":"vscore-program","role":"source","slot_id":"vscore-source"}],"bridge_id":"generic-readable","claims":[{"claim_id":"BRIDGE:structure:generic-readable","premises":[],"result_predicate":"bridge-structural/0.1","root_kind":"bridge_artifacts","verifier_id":"verislop.bridge-preparation"},{"claim_id":"BRIDGE:generic-readable:vscore-refinement","premises":["BRIDGE:structure:generic-readable"],"result_predicate":"bridge-semantic-edge/0.1","root_kind":"semantic_edge","verifier_id":"verislop.vscore3-checker"}],"declared_trust":[{"description":"The delivered artifact is the VSCore source; its meaning is the verifier-owned VSCore 0.3 Lean semantics. Executing it with any host interpreter or compiler is outside this edge.","id":"vscore-semantics","kind":"semantics"},{"description":"Lean 4 kernel of the pinned toolchain and the axioms allowed by the accepted policy.","id":"lean-kernel","kind":"logic"}],"edges":[{"claim_id":"BRIDGE:generic-readable:vscore-refinement","edge_id":"reference-to-vscore","expected_proposition_hash":"sha256:84573f08301096e26e27d712826bc52f45510f2de36295223cd4dd84ef1184a7","model_refs":[{"id":"contract-model","sha256":"sha256:6a54bf40264634663103c6880c2fc69297f467c0ec133c02f2b5843b71ead8aa"},{"id":"vscore-model","sha256":"sha256:6667cd295995ac0150a313a8c418dfea463b59edb2335f7d9dd6690f5d474d2a"}],"profile_refs":[{"id":"contract-profile","sha256":"sha256:b26676c91b1b2863c7710cb33501330af339c812c4f30027f2c6aa2afed0845a"},{"id":"vscore-profile","sha256":"sha256:99a59fde7ebe81e2a6ddab99bea0328f7b3390ac8e1a062ac212c12311b3029d"}],"relation":{"id":"vscore-relation","sha256":"sha256:0d1303bfe83ee9ccfd343321b5293cdd65b24aad16da0cbcb25b1c1cebf707d7"},"source_node":"accepted-contract","target_node":"vscore-program"}],"endpoint":"restricted_source","format":"verislop.bridge-plan/0.1","nodes":[{"artifact_slots":["acceptance-certificate","accepted-environment","accepted-ir","accepted-module","accepted-statements","bridge-proposal","contract-model","contract-profile","import-receipt"],"kind":"accepted_contract","model_ref":{"id":"contract-model","sha256":"sha256:6a54bf40264634663103c6880c2fc69297f467c0ec133c02f2b5843b71ead8aa"},"node_id":"accepted-contract","profile_ref":{"id":"contract-profile","sha256":"sha256:b26676c91b1b2863c7710cb33501330af339c812c4f30027f2c6aa2afed0845a"}},{"artifact_slots":["vscore-model","vscore-profile","vscore-proof","vscore-readable-diagnostic-0","vscore-readable-selection","vscore-relation","vscore-source"],"kind":"restricted_source","model_ref":{"id":"vscore-model","sha256":"sha256:6667cd295995ac0150a313a8c418dfea463b59edb2335f7d9dd6690f5d474d2a"},"node_id":"vscore-program","profile_ref":{"id":"vscore-profile","sha256":"sha256:99a59fde7ebe81e2a6ddab99bea0328f7b3390ac8e1a062ac212c12311b3029d"}}],"obligations":[{"accepted_statement_hash":"sha256:20c4215bb3889e36a2db038d05182c4edf47701409bad42f2e8e06485bddadba","id":"GF","required_claims":["BRIDGE:generic-readable:vscore-refinement"],"revision":1}],"reproducible_slots":["vscore-model","vscore-profile","vscore-proof","vscore-readable-diagnostic-0","vscore-readable-selection","vscore-relation","vscore-source"],"schema_version":"0.1","tier":2}